{
  "$schema": "https://soundbytelabs.net/schema/mcu.schema.json",
  "version": "1.0",
  "mcu": "rp2040",
  "family": "rp2040",
  "vendor": "raspberry-pi",
  "arch": "arm-cortex-m0plus",
  "driver": "./driver",
  "gpio": {
    "GPIO0":  { "port": 0, "pin": 0 },
    "GPIO1":  { "port": 0, "pin": 1 },
    "GPIO2":  { "port": 0, "pin": 2 },
    "GPIO3":  { "port": 0, "pin": 3 },
    "GPIO4":  { "port": 0, "pin": 4 },
    "GPIO5":  { "port": 0, "pin": 5 },
    "GPIO6":  { "port": 0, "pin": 6 },
    "GPIO7":  { "port": 0, "pin": 7 },
    "GPIO8":  { "port": 0, "pin": 8 },
    "GPIO9":  { "port": 0, "pin": 9 },
    "GPIO10": { "port": 0, "pin": 10 },
    "GPIO11": { "port": 0, "pin": 11 },
    "GPIO12": { "port": 0, "pin": 12 },
    "GPIO13": { "port": 0, "pin": 13 },
    "GPIO14": { "port": 0, "pin": 14 },
    "GPIO15": { "port": 0, "pin": 15 },
    "GPIO16": { "port": 0, "pin": 16 },
    "GPIO17": { "port": 0, "pin": 17 },
    "GPIO18": { "port": 0, "pin": 18 },
    "GPIO19": { "port": 0, "pin": 19 },
    "GPIO20": { "port": 0, "pin": 20 },
    "GPIO21": { "port": 0, "pin": 21 },
    "GPIO22": { "port": 0, "pin": 22 },
    "GPIO23": { "port": 0, "pin": 23 },
    "GPIO24": { "port": 0, "pin": 24 },
    "GPIO25": { "port": 0, "pin": 25 },
    "GPIO26": { "port": 0, "pin": 26 },
    "GPIO27": { "port": 0, "pin": 27 },
    "GPIO28": { "port": 0, "pin": 28 },
    "GPIO29": { "port": 0, "pin": 29 }
  },
  "adc": {
    "ADC0": { "adc": 0, "channel": 0, "gpio": "GPIO26" },
    "ADC1": { "adc": 0, "channel": 1, "gpio": "GPIO27" },
    "ADC2": { "adc": 0, "channel": 2, "gpio": "GPIO28" },
    "ADC3": { "adc": 0, "channel": 3, "gpio": "GPIO29" },
    "ADC4": { "adc": 0, "channel": 4 }
  }
}
